{
  "date": "2026-10-09",
  "generatedAt": "2026-10-09T10:08:43Z",
  "params": {
    "cap": 150,
    "perSourceCap": 8,
    "nearDupHours": 48,
    "nearDupJaccard": 0.6,
    "clusterHours": 72
  },
  "stats": {
    "before": 1057,
    "afterExact": 816,
    "afterNearDup": 816,
    "clusters": 3,
    "afterCap": 102,
    "priorEditions": 1
  },
  "items": [
    {
      "id": "6196136eecc5a0dffd7e3a8c4e16bca9d62fd37a",
      "url": "https://arxiv.org/abs/2610.10787",
      "canonicalUrl": "https://arxiv.org/abs/2610.10787",
      "title": "NavGPT-3: Harnessing Context in a Hierarchical Navigation Runtime",
      "source": "arXiv cs.AI",
      "sourceTier": 1,
      "categoryHint": "Research",
      "author": "Gengze Zhou, Yicong Hong, Jiazhao Zhang, Xunyi Zhao, Jian Zhou, Zixing Lei, Zun Wang, Chongyang Zhao, et al.",
      "publishedAt": "2026-10-09T04:00:00Z",
      "fetchedAt": "2026-10-09T10:08:36Z",
      "signals": {
        "hnPoints": null,
        "hnComments": null,
        "redditScore": null,
        "githubStars": null,
        "githubStarsDelta": null,
        "crossSourceCount": 4
      },
      "mergedSources": [
        "arXiv cs.AI",
        "arXiv cs.CL",
        "arXiv cs.CV",
        "arXiv cs.LG"
      ],
      "clusterId": null,
      "previouslyFeatured": false,
      "trendDelta": 1,
      "preScore": 7
    },
    {
      "id": "a0abe38a6464d737a4193944b5a9703ce112f556",
      "url": "https://arxiv.org/abs/2610.11794",
      "canonicalUrl": "https://arxiv.org/abs/2610.11794",
      "title": "Memento 3: Model-Based Recursive Self-Improvement through Reflective Rulebooks",
      "source": "arXiv cs.AI",
      "sourceTier": 1,
      "categoryHint": "Research",
      "author": "Haoyu Zhao, Zhengxu Yu, Zhiyuan He, Meng Fang, Rasul Tutunov, Haitham Bou-Ammar, Weilin Luo, Jun Wang",
      "publishedAt": "2026-10-09T04:00:00Z",
      "fetchedAt": "2026-10-09T10:08:36Z",
      "signals": {
        "hnPoints": null,
        "hnComments": null,
        "redditScore": null,
        "githubStars": null,
        "githubStarsDelta": null,
        "crossSourceCount": 4
      },
      "mergedSources": [
        "arXiv cs.AI",
        "arXiv cs.CL",
        "arXiv cs.CV",
        "arXiv cs.LG"
      ],
      "clusterId": null,
      "previouslyFeatured": false,
      "trendDelta": 1,
      "preScore": 7
    },
    {
      "id": "ec61288089937760a662023eb5618b19de97218c",
      "url": "https://arxiv.org/abs/2610.11140",
      "canonicalUrl": "https://arxiv.org/abs/2610.11140",
      "title": "ActiveMedAgent: Cost-Aware Trajectory Learning for Multimodal Medical Diagnosis",
      "source": "arXiv cs.AI",
      "sourceTier": 1,
      "categoryHint": "Research",
      "author": "Weiwei Ma, Xiaobing Yu, Peijie Qiu, Jin Yang, Zhaoqi An, Xuanzhao Dong, Xiaoqi Zhao, Xiaofeng Liu",
      "publishedAt": "2026-10-09T04:00:00Z",
      "fetchedAt": "2026-10-09T10:08:36Z",
      "signals": {
        "hnPoints": null,
        "hnComments": null,
        "redditScore": null,
        "githubStars": null,
        "githubStarsDelta": null,
        "crossSourceCount": 4
      },
      "mergedSources": [
        "arXiv cs.AI",
        "arXiv cs.CL",
        "arXiv cs.CV",
        "arXiv cs.LG"
      ],
      "clusterId": null,
      "previouslyFeatured": false,
      "trendDelta": null,
      "preScore": 7
    },
    {
      "id": "20f10fb8824505f33d369b613a1e78af63b92600",
      "url": "https://arxiv.org/abs/2610.11132",
      "canonicalUrl": "https://arxiv.org/abs/2610.11132",
      "title": "SFT-as-Context Mitigates Forgetting in Supervised Fine-Tuning",
      "source": "arXiv cs.AI",
      "sourceTier": 1,
      "categoryHint": "Research",
      "author": "Kenan Tang, Andong Hua, Chengxuan Qian, Saket Tiwari, Yao Qin",
      "publishedAt": "2026-10-09T04:00:00Z",
      "fetchedAt": "2026-10-09T10:08:36Z",
      "signals": {
        "hnPoints": null,
        "hnComments": null,
        "redditScore": null,
        "githubStars": null,
        "githubStarsDelta": null,
        "crossSourceCount": 3
      },
      "mergedSources": [
        "arXiv cs.AI",
        "arXiv cs.CL",
        "arXiv cs.LG"
      ],
      "clusterId": null,
      "previouslyFeatured": false,
      "trendDelta": null,
      "preScore": 6
    },
    {
      "id": "2197e2ecc7b78314ec97246ddb6778af76f7ded2",
      "url": "https://arxiv.org/abs/2610.10786",
      "canonicalUrl": "https://arxiv.org/abs/2610.10786",
      "title": "Plan-and-Patch: Diffusion Language Models for Agentic Planning",
      "source": "arXiv cs.AI",
      "sourceTier": 1,
      "categoryHint": "Research",
      "author": "Syamantak Kumar, Jiang Guo, Hassan Hamad, Hideo Kobayashi, Yi Xiang, Yezhou Yang, Yanjun Qi, Daniele Bonadiman, et al.",
      "publishedAt": "2026-10-09T04:00:00Z",
      "fetchedAt": "2026-10-09T10:08:36Z",
      "signals": {
        "hnPoints": null,
        "hnComments": null,
        "redditScore": null,
        "githubStars": null,
        "githubStarsDelta": null,
        "crossSourceCount": 3
      },
      "mergedSources": [
        "arXiv cs.AI",
        "arXiv cs.CL",
        "arXiv cs.LG"
      ],
      "clusterId": null,
      "previouslyFeatured": false,
      "trendDelta": null,
      "preScore": 6
    },
    {
      "id": "29e2a0a2f24843951a152b35142a86069e6a7634",
      "url": "https://arxiv.org/abs/2610.12002",
      "canonicalUrl": "https://arxiv.org/abs/2610.12002",
      "title": "Agentic-TTT: Training test-time policy for test-time training",
      "source": "arXiv cs.AI",
      "sourceTier": 1,
      "categoryHint": "Research",
      "author": "Jiahao Lu, Mohan Kankanhalli",
      "publishedAt": "2026-10-09T04:00:00Z",
      "fetchedAt": "2026-10-09T10:08:36Z",
      "signals": {
        "hnPoints": null,
        "hnComments": null,
        "redditScore": null,
        "githubStars": null,
        "githubStarsDelta": null,
        "crossSourceCount": 3
      },
      "mergedSources": [
        "arXiv cs.AI",
        "arXiv cs.CL",
        "arXiv cs.LG"
      ],
      "clusterId": null,
      "previouslyFeatured": false,
      "trendDelta": null,
      "preScore": 6
    },
    {
      "id": "3be60cb811d5d9b737899734db9c3180c1f4fa9c",
      "url": "https://arxiv.org/abs/2610.11464",
      "canonicalUrl": "https://arxiv.org/abs/2610.11464",
      "title": "Who Verifies the Verifier? Co-Evolving Inspectable Graders with Self-Improving Agents",
      "source": "arXiv cs.AI",
      "sourceTier": 1,
      "categoryHint": "Research",
      "author": "Xing Zhang, Guanghui Wang, Yanwei Cui, Ziyuan Li, Wei Qiu, Bing Zhu, Peiyang He",
      "publishedAt": "2026-10-09T04:00:00Z",
      "fetchedAt": "2026-10-09T10:08:36Z",
      "signals": {
        "hnPoints": null,
        "hnComments": null,
        "redditScore": null,
        "githubStars": null,
        "githubStarsDelta": null,
        "crossSourceCount": 3
      },
      "mergedSources": [
        "arXiv cs.AI",
        "arXiv cs.CL",
        "arXiv cs.LG"
      ],
      "clusterId": null,
      "previouslyFeatured": false,
      "trendDelta": null,
      "preScore": 6
    },
    {
      "id": "5d8303e98c42f58bd52338868aa2f40900c03032",
      "url": "https://arxiv.org/abs/2610.12417",
      "canonicalUrl": "https://arxiv.org/abs/2610.12417",
      "title": "WOVEN: Weaving Visual World Modeling into Multimodal LLMs",
      "source": "arXiv cs.CL",
      "sourceTier": 1,
      "categoryHint": "Research",
      "author": "Zheyu Fan, Yue Zhang, Mingkai Deng, Kangrui Wang, Qineng Wang, Canyu Chen, Jie Hao, Xing Fan, Chenlei Guo, et al.",
      "publishedAt": "2026-10-09T04:00:00Z",
      "fetchedAt": "2026-10-09T10:08:37Z",
      "signals": {
        "hnPoints": null,
        "hnComments": null,
        "redditScore": null,
        "githubStars": null,
        "githubStarsDelta": null,
        "crossSourceCount": 3
      },
      "mergedSources": [
        "arXiv cs.CL",
        "arXiv cs.CV",
        "arXiv cs.LG"
      ],
      "clusterId": null,
      "previouslyFeatured": false,
      "trendDelta": null,
      "preScore": 6
    },
    {
      "id": "625a994dcb2b7a579db12ce3c25ecc540ec77348",
      "url": "https://arxiv.org/abs/2610.10845",
      "canonicalUrl": "https://arxiv.org/abs/2610.10845",
      "title": "Real Long-Term Memory for AI: A 50-Million-Token Window That Is Faster and Cheaper Than Recompute",
      "source": "arXiv cs.AI",
      "sourceTier": 1,
      "categoryHint": "Research",
      "author": "Sietse Schelpe",
      "publishedAt": "2026-10-09T04:00:00Z",
      "fetchedAt": "2026-10-09T10:08:36Z",
      "signals": {
        "hnPoints": null,
        "hnComments": null,
        "redditScore": null,
        "githubStars": null,
        "githubStarsDelta": null,
        "crossSourceCount": 3
      },
      "mergedSources": [
        "arXiv cs.AI",
        "arXiv cs.CL",
        "arXiv cs.LG"
      ],
      "clusterId": null,
      "previouslyFeatured": false,
      "trendDelta": null,
      "preScore": 6
    },
    {
      "id": "ffea26ba8e9318100c3290f13b69182ca44fe36c",
      "url": "https://arxiv.org/abs/2610.11160",
      "canonicalUrl": "https://arxiv.org/abs/2610.11160",
      "title": "LadderEdit: Edit-Level Residual Compression for Memory-Efficient Lifelong Editing of LLMs",
      "source": "arXiv cs.CL",
      "sourceTier": 1,
      "categoryHint": "Research",
      "author": "Xiaobing Yu, Peijie Qiu, Jin Yang, Xuanzhao Dong, Weiwei Ma, Zhaoqi An, Xiaoqi Zhao, Xiaofeng Liu",
      "publishedAt": "2026-10-09T04:00:00Z",
      "fetchedAt": "2026-10-09T10:08:37Z",
      "signals": {
        "hnPoints": null,
        "hnComments": null,
        "redditScore": null,
        "githubStars": null,
        "githubStarsDelta": null,
        "crossSourceCount": 3
      },
      "mergedSources": [
        "arXiv cs.CL",
        "arXiv cs.CV",
        "arXiv cs.LG"
      ],
      "clusterId": null,
      "previouslyFeatured": false,
      "trendDelta": null,
      "preScore": 6